date,Content,Likes,Retweet
2012-03-28 00:32:07+00:00,"The Model S beta endurance car just passed 150,000 miles on a single battery pack!",29,157
2012-03-22 07:10:10+00:00,Interesting interview with Vinge about superhuman AI and optimistic apocalypses http://t.co/TVoqGpEG,39,30
2012-03-20 21:05:26+00:00,Support @Polar_Broadband as they try to save a good satellite from becoming space junk. Let it live! http://t.co/GEdkLh3h #antarctica,8,38
2012-03-15 09:37:28+00:00,Lovely poster about wishes that explains one of the many reasons to make life multiplanetary http://t.co/e1ZM8a2b,1414,309
2012-03-15 01:36:58+00:00,"10 years ago today, SpaceX was founded. Many battles fought. Physics always won. http://t.co/p85UHeuq",98,132
2012-03-14 23:06:03+00:00,"Why I'm leaving the Empire, by Darth Vader  http://t.co/D5YUbAyO",17,49
2012-03-13 07:27:14+00:00,"If something is physically possible, not only is someone doing it, but there is also an award show.",31,38
2012-03-12 06:45:14+00:00,"Mountain lions eat cats, which means we *actually* live in a cat eat cat world ... an apology is owed to dogkind!",58,55
2012-03-11 16:21:59+00:00,"I think if you go there, they just feed you delicious candy all day and ask nothing in return.",22,7
2012-03-11 15:31:43+00:00,Just passed a place called the Sugar Shack in a Louisiana swamp. I wonder what happens there? http://t.co/1MomQnNe,529,42
2012-03-07 01:52:14+00:00,The President of Serbia came by our booth at the Geneva Motor Show and talked about Nikola Tesla http://t.co/KIhxc0TF,360,111
2012-03-02 00:29:56+00:00,Dawn at Cape Canaveral http://t.co/ZHkcffYr,22,19
2012-02-29 07:02:03+00:00,"@TomMao1 Studied physics in college, read a lot of books and was taught by the world's leading domain experts at SpaceX.",37,9
2012-02-28 22:25:50+00:00,"Falcon 9 and Dragon now vertical on the launch pad, surrounded by 300 ft tall lightning towers http://t.co/iERgA2RP",51,123
2012-02-25 22:17:04+00:00,"@LooperNor Yes, this will, if all goes well, be the first commercial spaceship to dock with the Space Station. T zero ~ end of April.",12,12
2012-02-25 22:04:41+00:00,Dragon spaceship and Falcon 9 rocket just completed final assembly at Cape Canaveral http://t.co/4GrSr3VU,84,214
2012-02-25 18:36:12+00:00,Supporting the drive to get a #PlutoStamp for the @NASA New Horizons mission,8,12
2012-02-22 00:57:28+00:00,@NASA launched a rocket into the northern lights http://t.co/tR2cSeMV,161,160
2012-02-21 16:27:16+00:00,"Iran's nuclear weapons facility is apparently called ""Frodo"". Watch out for Gollum! My precious... http://t.co/s1hLZ0vs",237,48
2012-02-17 00:51:21+00:00,Important point highlighted by @kqed: an electric car in California produces only 1/4 CO2 of gasoline http://t.co/xV3eWJ33,7,31
2012-02-14 01:32:06+00:00,Model X review by Jim Motavalli. I think he likes the car. http://t.co/aY1nx9FP,22,55
2012-02-12 20:37:52+00:00,"At the Samovar having tea called ""monkey picked iron goddess of mercy"". Those monkeys sure know their tea. http://t.co/ctEWczlC",177,26
2012-02-10 19:54:59+00:00,Do not search for purple squirrels! Giving them attention only makes them want to be more purple.,3429,812
2012-02-10 19:38:00+00:00,"Tesla Model X is 3rd most searched term on Google, right after purple squirrel. Damn you squirrel! http://t.co/jP9H5XrB",373,140
2012-02-10 17:23:17+00:00,Tesla Model X video  http://t.co/pjcaicOc,15,49
2012-02-10 16:51:47+00:00,"@TeslasBigFan Don't worry, we've got a cool solution for ski storage on the X with the Falcon wing doors",8,3
2012-02-09 16:37:45+00:00,Model X sketch showing just a bit more leg. Unveiling tonight... http://t.co/KASHBP5p,140,100
2012-02-08 19:13:44+00:00,"Cool new @NASA pic of the most powerful type of solar flare, called X-class. Am not making this up! http://t.co/eJKSQqvO",218,74
2012-02-08 04:40:20+00:00,Russia and China are blocking UN action. Can't imagine why they wouldn't support a democratic uprising...,62,46
2012-02-08 04:35:43+00:00,Wish there was something we could do to help the people of Syria.   http://t.co/Ii7v7Cgw,45,24
2012-02-07 07:13:16+00:00,"@BenToBeWild Yes, we will unveil a fully functional advanced prototype of the Model X -- almost identical to production.",5,8
2012-02-06 01:44:18+00:00,The sheer size of Falcon Heavy is mind-blowing. It could literally send a fully loaded London bus to the moon.,24,85
2012-02-06 01:33:43+00:00,The London Sunday Times created a chart showing how Falcon compares to the Saturn V and Shuttle http://t.co/nJMPtYPd,96,136
2012-02-05 20:07:16+00:00,Just posted a photo http://t.co/eN9xzbfO,27,6
2012-02-04 20:42:54+00:00,"@MacDeviant Yeah, we will stream the whole mission realtime with no buffer. You see what we see.",16,8
2012-02-04 02:28:24+00:00,Docking with Space Station now likely to happen in April. Hopefully will look something like this: http://t.co/A2gd9ziC,55,100
2012-02-02 17:00:34+00:00,The most interesting view of the Model X is really with the doors open http://t.co/On77BuiU,80,53
2012-02-01 16:03:05+00:00,Just test-fired the Superdraco rocket engine. Enables launch escape and landing on thrusters. SpaceX.com http://t.co/IJaYVEE9,70,66
2012-02-01 09:12:24+00:00,"Um, while awesome in its own way, that was not actually the SpaceX theme song. It seems that irony is sometimes lost in a tweet.",86,14
2012-01-31 16:49:58+00:00,The SpaceX theme song by Total Ghost is just too good ... ooh ooh ooh http://t.co/BuKuopI5,92,31
2012-01-28 19:54:40+00:00,The lady doth protest too little. http://t.co/jJTbU8tg,56,8
2012-01-28 02:21:03+00:00,The Model X unveiling will be webcast live on http://t.co/S4ZQwTgq at 8pm on Feb 9th. Most cars are pretty blah. This is not.,24,103
2012-01-27 20:35:04+00:00,Beautiful picture of Earth from the new NASA satellite http://t.co/uOgyp4vg,165,98
2012-01-24 04:03:10+00:00,Design completed for bringing rocket back to launchpad using only thrusters. Yay. Wings r just dead weight in space.,377,141
2012-01-24 03:04:49+00:00,Strongest solar radiation storm in 7 years is blasting Earth. This huge eruption hits us tomorrow: http://t.co/VF3gTu3L,377,420
2012-01-23 01:42:54+00:00,Bought some wood and built a little treehouse with my boys. Few more beautiful ways to spend an afternoon.,27,10
2012-01-22 00:44:23+00:00,@TheOnion I heard Lars von Trier optioned the movie rights,8,5
2012-01-18 01:54:53+00:00,"That said, even though they cause me grief, I would defend the right of shorts to exist. They are often unreasonably maligned.",6531,368
2012-01-17 22:07:50+00:00,That's not just paranoia (a healthy trait at times). Tesla really is under massive attack by short sellers http://t.co/PUxAOOm2,45,24
2012-01-17 17:47:19+00:00,Will communicate better in the future. Too many people want us to fail and are willing to twist any bit of news against Tesla.,173,48
2012-01-17 17:44:57+00:00,"TSLA down ~$500M Friday, but back up ~$500M today. Sorry for the roller coaster.",7397,114
2012-01-14 20:29:34+00:00,"Somebody needs to tell Kim Jong-un that the showbiz phrase ""break a leg"" doesn't mean what he thinks it does",69,12
2012-01-14 20:27:41+00:00,"Once more, with feeling!  ""North Korea Punishes Insincere Mourners"" http://t.co/ozqhp1aC",8,16
2012-01-13 05:49:17+00:00,"A Tesla Roadster just passed the 100,000 mile mark for the first time and still has over 200 miles of range.",19,50
2012-01-12 23:07:42+00:00,What is more magical than cowboys herding cats? Livin' the dream...  http://t.co/1pLhb9lc,121,30
2012-01-12 21:07:59+00:00,"Kids these days are so grown up! RT ""Second-Graders Wow Audience With School Production Of Equus"" http://t.co/YgyAIrwI",17,5
2012-01-12 02:47:48+00:00,Model S Performance powertrain produced so much torque today that we broke the dyno. 4.4 sec 0-60 mph will not be a problem.,31,110
2012-01-11 02:36:39+00:00,"The exec conf room at Tesla used to be called Denali, but I decided to move a few letters around. Seemed more apt :) http://t.co/Raq5UaR6",304,64
2012-01-06 20:09:40+00:00,Model S Signature series sold out as of today https://t.co/pKbR0ziP,13,45
2012-01-06 17:30:01+00:00,Next month is also when our Dragon spaceship docks with the Space Station for the first time. Major pucker factor...,47,35
2012-01-06 17:28:01+00:00,Feb is huge month. Model X world premier and public reveal of our LA design studio on the 9th. Stay tuned for more details.,20,27
2012-01-03 21:28:25+00:00,Just finished Massie's book on Catherine. An amazingly expansive and compelling portrait of an incredible woman. Highly recommend.,33,5
2012-01-03 21:04:51+00:00,"@om Respectfully disagree. Larry  made awesome moves last year, which laid the foundation for G+ to kick butt in 2012. He's a stud.",30,14
2012-01-03 06:58:13+00:00,"What everyone really thinks ... RT “@jonlovett: If Mayans were good at predicting the future, there'd be Mayans.”",35,91
2012-01-01 21:52:44+00:00,"On a lighter note, the RHCP are f* awesome. No better way to bring in the New Year... http://t.co/TlkAdzsk",98,19
2012-01-01 20:49:05+00:00,I said *information* weapons for a reason. The bit is mightier than the bomb.,48,24
2012-01-01 20:41:34+00:00,"If we are not careful, we will find that knife against liberty's neck. Fate has a great sense of irony. http://t.co/OQ2u1zHQ",24,18
2012-01-01 20:33:16+00:00,"We built powerful information weapons to fight enemies of liberty. Now those enemies are largely defeated, but the weapons remain.",48,31
2012-01-01 16:54:27+00:00,"@FareedZakaria However, China's real estate crisis will explode in a way that makes ours look puny. They can't hide it for much longer.",10,4
2012-01-01 16:49:40+00:00,"@FareedZakaria Yeah, 2012 will be great for the American economy & jobs, as we've mostly dealt with the overbuilt housing crisis.",36,4
2012-01-01 16:40:27+00:00,"My first prediction of 2012 has come true: ouch, my head hurts.",330,22
